id,category,sub_category,title,content
1,Environment,Air Quality,Air Quality Standards,"Standards set for pollutants in the air."
2,Health,Public Health,Public Health Guidelines,"Guidelines for public health safety."
4,Safety,Workplace Safety,Workplace Safety Regulations,"Regulations ensuring safety in workplaces."
5,Environment,Water Quality,Water Quality Regulations,"Regulations for the quality of water."
8,Health,Medical,Medical Standards,"Standards for medical practices and equipment."
9,Safety,Consumer Safety,Consumer Product Safety,"Regulations for consumer product safety requirements."
10,Environment,Waste Management,Waste Management Guidelines,"Guidelines for effective waste management."
23,Safety,Transportation,Transportation Safety Regulations,"Regulations related to safe transportation practices."
24,Health,Nutrition,Nutrition Guidelines,"Guidelines for healthy nutrition practices."